<?xml version="1.0" encoding="UTF-8"?>
<!ELEMENT list ((PhantomWeapons+))>
<!ELEMENT item EMPTY>
<!ATTLIST item
	item_id CDATA #REQUIRED
>
<!ELEMENT PhantomWeapons ((item))>
<!ATTLIST PhantomWeapons
	class_id CDATA #REQUIRED
	grade CDATA #REQUIRED
>
