<?xml version="1.0" encoding="utf-8"?>
<!DOCTYPE list SYSTEM "weapon.dtd">
<list>
	<PhantomWeapons class_id="27" grade="C">
		<item item_id="206" />  
	</PhantomWeapons>
	<PhantomWeapons class_id="27" grade="B">
		<item item_id="92" />  
	</PhantomWeapons>
	<PhantomWeapons class_id="27" grade="B">
		<item item_id="210" />  
	</PhantomWeapons>
	<PhantomWeapons class_id="27" grade="A">
		<item item_id="212" />  
	</PhantomWeapons>
	<PhantomWeapons class_id="27" grade="A">
		<item item_id="8688" />  
	</PhantomWeapons>
	<PhantomWeapons class_id="103" grade="S">
		<item item_id="6579" />   
	</PhantomWeapons>
 </list>
